{
  "floor_plan_url": "file:///Users/tarive/haus/haus/.haus-cache/floor-plans/20bc605e36e2cf1b5288627f1646051e548dd6b4e7c2ed59d932e731ac451cf4.png",
  "floor_plan_metadata": {
    "source": "local_upload",
    "mime_type": "image/png",
    "size_bytes": 63643,
    "width_px": 448,
    "height_px": 480,
    "sha256": "20bc605e36e2cf1b5288627f1646051e548dd6b4e7c2ed59d932e731ac451cf4",
    "cache_key": "20bc605e36e2cf1b5288627f1646051e548dd6b4e7c2ed59d932e731ac451cf4"
  },
  "floor_plan_measurements": {
    "source": "ml_parser",
    "unit": "ft",
    "scale": null,
    "rooms": [
      {
        "room_id": null,
        "name": "Nest",
        "dimensions": {
          "width": 12.166666666666666,
          "length": 14.666666666666666,
          "area": 178.44444444444446
        },
        "unit": "ft",
        "confidence": 0.95
      },
      {
        "room_id": null,
        "name": "Taste (Kitchen)",
        "dimensions": {
          "width": 9.5,
          "length": 10.583333333333334,
          "area": 100.54166666666667
        },
        "unit": "ft",
        "confidence": 0.95
      },
      {
        "room_id": null,
        "name": "Dining (Dine)",
        "dimensions": {
          "width": 9.333333333333334,
          "length": 12,
          "area": 112
        },
        "unit": "ft",
        "confidence": 0.8
      },
      {
        "room_id": null,
        "name": "Bedroom (Dream) - upper-left",
        "dimensions": {
          "width": 10,
          "length": 10,
          "area": 100
        },
        "unit": "ft",
        "confidence": 0.95
      },
      {
        "room_id": null,
        "name": "Bedroom (Dream) - right",
        "dimensions": {
          "width": 11.25,
          "length": 11.333333333333334,
          "area": 127.5
        },
        "unit": "ft",
        "confidence": 0.9
      },
      {
        "room_id": null,
        "name": "Bedroom (Dream) - bottom",
        "dimensions": {
          "width": 11.333333333333334,
          "length": 13.75,
          "area": 155.83333333333334
        },
        "unit": "ft",
        "confidence": 0.9
      }
    ],
    "notes": null
  },
  "pinterest_board_url": "https://www.pinterest.com/tarive22/dark-interior/",
  "brief": "dark",
  "objects": [
    "crib",
    "standing_desk"
  ],
  "platform": "all",
  "timestamp": "2026-05-10T11:49:34.264Z",
  "session_id": "1eba8844-2923-44d5-b26c-63b96588f8eb"
}
