{
  "floor_plan_url": "file:///Users/quamos/Repos/haus/.haus-cache/floor-plans/1aa09dc40ee4146b959697cacea0fa6fc22fc075f909eafac42fa24027afad5f.png",
  "floor_plan_metadata": {
    "source": "local_upload",
    "mime_type": "image/png",
    "size_bytes": 71152,
    "width_px": 448,
    "height_px": 480,
    "sha256": "1aa09dc40ee4146b959697cacea0fa6fc22fc075f909eafac42fa24027afad5f",
    "cache_key": "1aa09dc40ee4146b959697cacea0fa6fc22fc075f909eafac42fa24027afad5f"
  },
  "floor_plan_measurements": {
    "source": "ml_parser",
    "unit": "ft",
    "scale": null,
    "rooms": [
      {
        "room_id": null,
        "name": "Bedroom",
        "dimensions": {
          "width": 11.6666666667,
          "length": 13.6666666667,
          "area": 159.4444444444
        },
        "unit": "ft",
        "confidence": 0.95
      },
      {
        "room_id": null,
        "name": "Bedroom",
        "dimensions": {
          "width": 11.6666666667,
          "length": 12.3333333333,
          "area": 143.8888888889
        },
        "unit": "ft",
        "confidence": 0.95
      },
      {
        "room_id": null,
        "name": "Living Room",
        "dimensions": {
          "width": 12.5,
          "length": 14.5833333333,
          "area": 182.2916666663
        },
        "unit": "ft",
        "confidence": 0.95
      },
      {
        "room_id": null,
        "name": "Dining Room",
        "dimensions": {
          "width": 7.6666666667,
          "length": 9.6666666667,
          "area": 74.1111111111
        },
        "unit": "ft",
        "confidence": 0.95
      }
    ],
    "notes": null
  },
  "pinterest_board_url": "https://www.pinterest.com/tarive22/artistic-interior/",
  "brief": "vibrant, lively, calm, and artistic vibe",
  "objects": [
    "bookshelf"
  ],
  "platform": "all",
  "timestamp": "2026-05-10T10:36:03.731Z",
  "session_id": "672e21d8-887d-4e92-bce1-68c01abaa20c"
}
