{
  "floor_plan_url": "file:///Users/quamos/Repos/haus/.haus-cache/floor-plans/a2a3a3fe4942f6b982f5333a7b9c70b254ec2c82164872a3bf121f97eff375e6.png",
  "floor_plan_metadata": {
    "source": "local_upload",
    "mime_type": "image/png",
    "size_bytes": 64138,
    "width_px": 448,
    "height_px": 480,
    "sha256": "a2a3a3fe4942f6b982f5333a7b9c70b254ec2c82164872a3bf121f97eff375e6",
    "cache_key": "a2a3a3fe4942f6b982f5333a7b9c70b254ec2c82164872a3bf121f97eff375e6"
  },
  "floor_plan_measurements": {
    "source": "ml_parser",
    "unit": "ft",
    "scale": null,
    "rooms": [
      {
        "room_id": null,
        "name": "Dream",
        "dimensions": {
          "width": 12.5,
          "length": 11.583,
          "area": 144.792
        },
        "unit": "ft",
        "confidence": 0.95
      },
      {
        "room_id": null,
        "name": "Nest",
        "dimensions": {
          "width": 11.917,
          "length": 11.667,
          "area": 139.028
        },
        "unit": "ft",
        "confidence": 0.95
      },
      {
        "room_id": null,
        "name": "Dine",
        "dimensions": {
          "width": 7.833,
          "length": 8,
          "area": 62.667
        },
        "unit": "ft",
        "confidence": 0.95
      }
    ],
    "notes": null
  },
  "pinterest_board_url": "https://www.pinterest.com/tarive22/dark-interior/",
  "brief": "Warm, calm home for a young family that needs a cozy work corner.",
  "objects": [
    "standing_desk",
    "bookshelf"
  ],
  "platform": "all",
  "timestamp": "2026-05-10T21:03:18.113Z",
  "session_id": "2970fb90-d64f-4315-8450-7d5c38786471"
}
